{
  "schema_version": "mcp-tool-registry/1.0",
  "api_version": "0.3",
  "stability": "alpha",
  "input_schema_source": "tools/list.inputSchema",
  "response_schema": "mcp-tool-result/1.0",
  "tools": [
    {"name": "benchwork_status", "category": "read", "permission": "read", "risk": "low", "approval": "none", "canonical_effect": "none"},
    {"name": "benchwork_list_programs", "category": "read", "permission": "read", "risk": "low", "approval": "none", "canonical_effect": "none"},
    {"name": "benchwork_get_program", "category": "read", "permission": "read", "risk": "low", "approval": "none", "canonical_effect": "none"},
    {"name": "benchwork_get_object", "category": "read", "permission": "read", "risk": "low", "approval": "none", "canonical_effect": "none"},
    {"name": "benchwork_get_review", "category": "read", "permission": "read", "risk": "low", "approval": "none", "canonical_effect": "none"},
    {"name": "benchwork_trace", "category": "read", "permission": "read", "risk": "low", "approval": "none", "canonical_effect": "none"},
    {"name": "benchwork_next_actions", "category": "read", "permission": "read", "risk": "low", "approval": "none", "canonical_effect": "none"},
    {"name": "benchwork_get_schema", "category": "read", "permission": "read", "risk": "low", "approval": "none", "canonical_effect": "none"},
    {"name": "benchwork_doctor", "category": "read", "permission": "read", "risk": "low", "approval": "none", "canonical_effect": "none"},

    {"name": "benchwork_open_task", "category": "task", "permission": "propose", "risk": "medium", "approval": "ward", "canonical_effect": "task_event"},
    {"name": "benchwork_get_task", "category": "task", "permission": "read", "risk": "low", "approval": "none", "canonical_effect": "none"},
    {"name": "benchwork_complete_task", "category": "task", "permission": "commit", "risk": "medium", "approval": "ward", "canonical_effect": "task_event"},
    {"name": "benchwork_fail_task", "category": "task", "permission": "commit", "risk": "medium", "approval": "ward", "canonical_effect": "task_event"},

    {"name": "benchwork_create_program", "category": "canonical", "permission": "commit", "risk": "medium", "approval": "ward", "canonical_effect": "canonical_event"},
    {"name": "benchwork_record_evidence", "category": "canonical", "permission": "commit", "risk": "medium", "approval": "ward", "canonical_effect": "canonical_event"},
    {"name": "benchwork_verify_evidence", "category": "canonical", "permission": "commit", "risk": "medium", "approval": "ward", "canonical_effect": "canonical_event"},
    {"name": "benchwork_create_claim", "category": "canonical", "permission": "commit", "risk": "medium", "approval": "ward", "canonical_effect": "canonical_event"},
    {"name": "benchwork_verify_claim_relation", "category": "canonical", "permission": "commit", "risk": "medium", "approval": "ward", "canonical_effect": "canonical_event"},
    {"name": "benchwork_create_hypothesis", "category": "canonical", "permission": "commit", "risk": "medium", "approval": "ward", "canonical_effect": "canonical_event"},
    {"name": "benchwork_draft_protocol", "category": "canonical", "permission": "commit", "risk": "medium", "approval": "ward", "canonical_effect": "canonical_event"},
    {"name": "benchwork_open_issue", "category": "canonical", "permission": "commit", "risk": "medium", "approval": "ward", "canonical_effect": "canonical_event"},
    {"name": "benchwork_record_assessment", "category": "canonical", "permission": "commit", "risk": "medium", "approval": "ward", "canonical_effect": "canonical_event"},
    {"name": "benchwork_prepare_review", "category": "canonical", "permission": "propose", "risk": "medium", "approval": "ward", "canonical_effect": "canonical_event"},
    {"name": "benchwork_approve_external_review", "category": "canonical", "permission": "commit", "risk": "high", "approval": "disclosure_gate", "canonical_effect": "canonical_event"},
    {"name": "benchwork_record_review", "category": "canonical", "permission": "commit", "risk": "high", "approval": "conditional_disclosure", "canonical_effect": "canonical_event"},
    {"name": "benchwork_accept_review", "category": "canonical", "permission": "commit", "risk": "high", "approval": "ward", "canonical_effect": "canonical_event"},
    {"name": "benchwork_preview_rq_seal", "category": "canonical", "permission": "propose", "risk": "medium", "approval": "none", "canonical_effect": "none"},
    {"name": "benchwork_commit_rq_seal", "category": "canonical", "permission": "commit", "risk": "high", "approval": "human_confirmation", "canonical_effect": "canonical_event"},
    {"name": "benchwork_preview_protocol_seal", "category": "canonical", "permission": "propose", "risk": "medium", "approval": "none", "canonical_effect": "none"},
    {"name": "benchwork_commit_protocol_seal", "category": "canonical", "permission": "commit", "risk": "high", "approval": "human_confirmation", "canonical_effect": "canonical_event"},
    {"name": "benchwork_preview_decision_seal", "category": "canonical", "permission": "propose", "risk": "medium", "approval": "none", "canonical_effect": "none"},
    {"name": "benchwork_commit_decision_seal", "category": "canonical", "permission": "commit", "risk": "high", "approval": "human_confirmation", "canonical_effect": "canonical_event"},

    {"name": "benchwork_start_working", "category": "experiment", "permission": "commit", "risk": "medium", "approval": "ward", "canonical_effect": "canonical_event"},
    {"name": "benchwork_register_artifact", "category": "experiment", "permission": "commit", "risk": "medium", "approval": "ward", "canonical_effect": "canonical_event"},
    {"name": "benchwork_create_experiment", "category": "experiment", "permission": "commit", "risk": "medium", "approval": "ward", "canonical_effect": "canonical_event"},
    {"name": "benchwork_transition_experiment", "category": "experiment", "permission": "commit", "risk": "high", "approval": "ward", "canonical_effect": "canonical_event"},
    {"name": "benchwork_record_run", "category": "experiment", "permission": "commit", "risk": "high", "approval": "ward", "canonical_effect": "canonical_event"},
    {"name": "benchwork_compute_analysis", "category": "experiment", "permission": "execute", "risk": "medium", "approval": "ward", "canonical_effect": "analysis_artifact"}
  ]
}
